{
  "contract_id": "iagora.commitment-mapping-review",
  "contract_version": "1.0.0",
  "review_packet_id": "review-mapping-schoolyards-respire-001",
  "review_packet_version": "0.5.0",
  "lifecycle_state": "ready_for_maintainer_review",
  "prepared_at": "2026-08-01T14:38:46Z",
  "preparation": {
    "origin": "ai_assisted",
    "maintainer_orientation": "validated_for_preparation",
    "counts_as_independent_review": false
  },
  "mapping_reference": {
    "mapping_id": "mapping-campaign-schoolyards-to-respire-001",
    "mapping_version": "0.3.0",
    "local_path": "data/pilot/commitment-mapping.json",
    "sha256": "286432d9aa2fb2a0f44d68d80cbe250bb2b7f46d14f5ebe2c9bcb0a7066729de"
  },
  "review_question": "Is the candidate correspondence between the 2019 schoolyard-regreening commitment and Respire à la récré sufficiently supported for continued local POC presentation under the publication block, without asserting direct implementation, novelty, fulfillment, outcomes, or impact?",
  "governing_adrs": ["ADR-0002", "ADR-0003", "ADR-0004", "ADR-0010"],
  "evidence_basis": [
    {
      "evidence_id": "evidence-campaign-schoolyards-2020",
      "role": "original_commitment",
      "relationship": "supports",
      "artifact_version_id": "campaign-naturellement-clermont-schoolyards-wayback-20191128144201",
      "locator": "HTML content block under the heading “Végétalisation” on the archived “Une ville nature” page",
      "source_url": "https://web.archive.org/web/20191128144201id_/https://olivierbianchi2020.fr/une-ville-nature/"
    },
    {
      "evidence_id": "evidence-pev-respire-definition-2023",
      "role": "programme_definition",
      "relationship": "contextualizes",
      "artifact_version_id": "artifact-pev-2023-adopted-annex",
      "locator": "printed page 25, Respire à la récré inset",
      "source_url": "https://clermont-ferrand.fr/docs/delib/CM05052023/CM05052023_004_annexe_0.pdf"
    },
    {
      "evidence_id": "evidence-pev-adoption-2023",
      "role": "policy_adoption",
      "relationship": "supports",
      "artifact_version_id": "artifact-pev-2023-final-deliberation",
      "locator": "page 2 of 3, decision paragraph",
      "source_url": "https://clermont-ferrand.fr/docs/delib/CM05052023/CM05052023_004.pdf"
    },
    {
      "evidence_id": "evidence-pev-policy-history-2023",
      "role": "policy_lineage_context",
      "relationship": "contextualizes",
      "artifact_version_id": "artifact-pev-2023-final-deliberation",
      "locator": "page 2 of 3, opening paragraphs",
      "source_url": "https://clermont-ferrand.fr/docs/delib/CM05052023/CM05052023_004.pdf"
    }
  ],
  "findings": [
    {
      "dimension": "original_formulation",
      "finding_state": "supported_with_limitations",
      "explanation": "The archived campaign-controlled page contains the exact wording “Végétalisation des cours d’école”; it is authenticated with limitations rather than treated as a certified profession of faith."
    },
    {
      "dimension": "name",
      "finding_state": "broader_later_scope",
      "explanation": "The campaign fragment gives no project name. “Respire à la récré” is a later municipal programme name and must not be retroactively inserted into the original wording."
    },
    {
      "dimension": "territory",
      "finding_state": "compatible",
      "explanation": "Both records concern municipal action in Clermont-Ferrand, but common territory alone does not prove continuity."
    },
    {
      "dimension": "beneficiaries",
      "finding_state": "broader_later_scope",
      "explanation": "The campaign fragment names schoolyards without an explicit beneficiary group. The later programme expressly addresses children and their varied needs."
    },
    {
      "dimension": "delivery_method",
      "finding_state": "broader_later_scope",
      "explanation": "The campaign fragment gives no delivery method. The later programme adds ecological design, cooling, permeability, inclusive play, and co-construction."
    },
    {
      "dimension": "timing",
      "finding_state": "not_comparable",
      "explanation": "The campaign fragment states no deadline. The later 2022–2025 policy period cannot become the campaign deadline."
    },
    {
      "dimension": "quantity_and_budget",
      "finding_state": "not_stated_in_campaign",
      "explanation": "The original fragment states no site count, denominator, budget, or financing plan, so no implementation percentage or budget-compliance test can be derived from it."
    },
    {
      "dimension": "direct_continuity",
      "finding_state": "insufficient",
      "explanation": "No retained first-class fragment directly states that Respire à la récré implements the campaign proposal."
    },
    {
      "dimension": "policy_lineage",
      "finding_state": "indeterminate_with_predecessors",
      "explanation": "The 2023 deliberation states that the municipal education project began in 2015, continued with PEV 2 in 2018, and that PEV 2022–2025 followed evaluation of PEV 2018–2022. The bounded evidence cannot classify Respire safely as new, continued, extended, reoriented, or campaign-attributable."
    }
  ],
  "counterevidence": {
    "state": "no_material_contradiction_identified_in_bounded_corpus",
    "evidence_ids": [],
    "search_boundary": "The authenticated campaign fragment, the adopted 2022–2025 education-project deliberation and annex, and the bounded administrative and procurement evidence retained for the pilot.",
    "limitations": [
      "The corpus is not exhaustive, so absence of identified counterevidence is not evidence that none exists.",
      "The documented 2015 and 2018 predecessors are policy-lineage context, not proof that the 2019 commitment had no effect."
    ]
  },
  "ai_advisory_roles": [
    {
      "role_id": "ai_methodology_auditor",
      "role_configuration_version": "0.3.0",
      "execution_mode": "manually_invoked_non_autonomous",
      "purpose": "Challenge the decomposition, scope comparison, relationship vocabulary, prohibited inferences, policy-lineage treatment, and plain-language conclusion before the maintainer decides whether the mapping is fit for continued local POC use.",
      "must_check": [
        "The original wording remains one unsplit, unquantified essential action component.",
        "Later programme name, beneficiaries, delivery method, quantity, budget, and dates are not imported into the campaign commitment.",
        "Candidate correspondence is not presented as implementation, fulfillment, novelty, outcome, impact, or political credit.",
        "The 2015 and 2018 predecessors and indeterminate policy lineage remain visible.",
        "No percentage is calculated from an undefined campaign denominator."
      ],
      "prohibited_actions": [
        "Do not approve the mapping or count the audit as human review.",
        "Do not treat model output as evidence.",
        "Do not invent a campaign target, deadline, budget, delivery state, or causal claim."
      ],
      "output_requirements": [
        "Return accept, reject, or request_changes as a non-binding recommendation.",
        "Identify blockers separately from caveats.",
        "Cite every evidence identifier used.",
        "State remaining uncertainty and conditions for re-review."
      ],
      "status": "completed"
    },
    {
      "role_id": "ai_evidence_authority_auditor",
      "role_configuration_version": "0.3.0",
      "execution_mode": "manually_invoked_non_autonomous",
      "purpose": "Challenge artifact identity, precise locators, authority boundaries, source relationships, policy-history context, counterevidence search limits, rights constraints, and version bindings before maintainer review.",
      "must_check": [
        "The campaign wording resolves to the authenticated-with-limitations archived campaign artifact.",
        "The programme definition and adoption resolve to the exact municipal PDF fragments.",
        "The 2015 and 2018 predecessor statement is contextual evidence rather than proof of continuity or novelty.",
        "No source is treated as authoritative outside its fact type and scope.",
        "The bounded search and absence-of-evidence limitations remain explicit."
      ],
      "prohibited_actions": [
        "Do not approve the mapping or count the audit as human review.",
        "Do not promote an inaccessible or missing source to authoritative status.",
        "Do not infer that an action did not occur because a document was not located."
      ],
      "output_requirements": [
        "Return accept, reject, or request_changes as a non-binding recommendation.",
        "Identify unresolved authority or traceability blockers.",
        "Cite every evidence identifier and locator used.",
        "State source, rights, search-boundary, and re-review limitations."
      ],
      "status": "completed"
    }
  ],
  "ai_advisory_runs": [
    {
      "run_id": "ai-review-methodology-001",
      "role_id": "ai_methodology_auditor",
      "role_configuration_version": "0.2.0",
      "reviewed_mapping_version": "0.2.0",
      "applicability_state": "historical_superseded_mapping",
      "status": "completed",
      "generated_at": "2026-08-01T14:23:14Z",
      "model_identifier": "Codex GPT-5 family; exact deployment identifier unavailable",
      "recommendation": "accept",
      "recommendation_rationale": "The proposal is methodologically fit for continued local POC use under the publication block: it preserves the unquantified campaign wording, limits the relationship to candidate correspondence, keeps the 2015 and 2018 predecessors visible, blocks unsupported percentages and inferences, and retains not_verifiable.",
      "evidence_ids_reviewed": [
        "evidence-campaign-schoolyards-2020",
        "evidence-pev-respire-definition-2023",
        "evidence-pev-adoption-2023",
        "evidence-pev-policy-history-2023"
      ],
      "findings": [